{
  "task_id": "T-UVD-20260808-001",
  "project_id": "PRJ-KAOYAN-NOTES",
  "product_version": "V1.0",
  "product_profile": {
    "name": "考研资料速筛助手",
    "one_line_value_claim": "帮二战考研生在 5 分钟内从海量资料里筛出本周该看的 3 份重点",
    "description": "上传或粘贴资料链接，按考纲与剩余天数自动排序，生成本周学习清单。团队自述已有 80 名内测用户。",
    "category": "教育效率工具",
    "url": "https://example-kaoyan.app",
    "experience_report_ref": "EV-PTA-20260807-004",
    "pricing_claim": "基础功能免费，进阶排序 29 元/月"
  },
  "target_users": {
    "raw_description": "准备考研的学生，特别是二战、时间紧、资料太多不知道看哪份的人",
    "segments": [
      "距考试 3 个月内的二战考研生",
      "跨专业首战考研生",
      "在职备考的社会考生"
    ],
    "exclusions": ["已上岸的学生", "只准备校内期末考的本科生"],
    "claimed_payer": "学生本人，少数由家长代付",
    "claimed_first_user": "距考试 3 个月内的二战考研生"
  },
  "product_tasks": [
    {
      "task_key": "upload_and_rank",
      "description": "上传 10 份资料并得到本周应看的 3 份排序结果",
      "expected_observable_outcome": "页面显示 3 份资料的排序列表，每份带推荐理由",
      "max_steps": 8
    },
    {
      "task_key": "adjust_by_deadline",
      "description": "把考试日期改为 45 天后，观察清单是否重新排序",
      "expected_observable_outcome": "清单顺序发生变化且提示剩余天数",
      "max_steps": 5
    },
    {
      "task_key": "export_weekly_plan",
      "description": "导出本周学习清单",
      "expected_observable_outcome": "生成可保存的清单文件或分享链接",
      "max_steps": 4
    }
  ],
  "existing_user_evidence": [
    {
      "evidence_id": "EV-USR-EXT-0001",
      "applies_to_product_version": "V1.0",
      "kind": "team_statement",
      "tier": "E0",
      "source": "团队提交的项目说明",
      "timestamp": "2026-08-01",
      "observation": "团队称已有 80 名内测用户，其中约 30 人每周使用",
      "applies_to_segment": "距考试 3 个月内的二战考研生"
    },
    {
      "evidence_id": "EV-USR-EXT-0002",
      "applies_to_product_version": "V1.0",
      "kind": "review",
      "tier": "E1",
      "source": "https://example-forum.com/thread/8821",
      "timestamp": "2026-07-20",
      "expiry": "2027-07-20",
      "observation": "考研论坛帖中 6 人抱怨资料太多无从下手，2 人自建 Excel 表管理",
      "sample_size": 8,
      "applies_to_segment": "距考试 3 个月内的二战考研生"
    },
    {
      "evidence_id": "EV-USR-EXT-0003",
      "applies_to_product_version": "V1.0",
      "kind": "interview",
      "tier": "E3",
      "source": "团队 2026-07 内测访谈记录（5 人）",
      "timestamp": "2026-07-25",
      "expiry": "2027-01-25",
      "observation": "5 名受访者中 4 人确认每周花 2 小时以上筛资料；3 人表示不会为此付费，愿意付费的 1 人上限为每月 20 元",
      "sample_size": 5,
      "applies_to_segment": "距考试 3 个月内的二战考研生",
      "applies_to_persona_ids": ["P1", "P2", "P3"],
      "supporting_claims": ["H1"],
      "contradicts_claims": ["H2"],
      "valid_for_dimensions": ["demand_strength", "pain_severity", "willingness_to_pay"]
    }
  ],
  "validation_goal": {
    "objective": "确认二战考研生的资料筛选需求是否为 must-have，以及 29 元/月定价是否可被接受",
    "focus_questions": [
      "用户是否真的需要这个产品",
      "用户为什么使用或拒绝使用",
      "下一步应该如何验证付费意愿"
    ],
    "priority_dimension": "willingness_to_pay"
  },
  "product_stage": "mvp",
  "constraints": {
    "time_budget_weeks": 4,
    "money_budget_cny": 2000,
    "recruitable_channels": ["考研微信群", "学校自习室", "小红书评论区"],
    "team_capacity_person_days": 10,
    "compliance_notes": null
  },
  "evidence_refs": ["EV-PTA-20260807-004"],
  "upstream_product_handoff": {
    "product_completeness": {
      "score": 3,
      "capped": true,
      "cap_reason": "no_product_access"
    },
    "product_maturity": {
      "stage": "mvp",
      "gap_list": ["导出功能仅前端占位", "未接入真实考纲数据"]
    },
    "blocking_observations": [
      {
        "task_key": "export_weekly_plan",
        "observation": "点击导出无响应，控制台报 404",
        "technical_attribution": "functional",
        "evidence_refs": ["EV-PTA-20260807-004"]
      }
    ],
    "broken_claim": false,
    "product_evidence_cards": []
  },
  "runtime": {
    "allowed_tools": ["product_reader", "simulation_engine", "evidence_writer", "kb_retriever"],
    "mode": "first_validation",
    "max_simulation_retries": 2
  }
}
