{
  "task_id": "T-UVD-20260809-005",
  "project_id": "PRJ-KAOYAN-NOTES",
  "product_version": "V1.0",
  "product_profile": {
    "name": "考研资料速筛助手",
    "one_line_value_claim": "帮二战考研生在 5 分钟内从海量资料里筛出本周该看的 3 份重点",
    "description": "上传或粘贴资料链接，按考纲与剩余天数自动排序。团队已完成一轮真实访谈、一轮可用性测试，并有留存与付费记录。",
    "category": "教育效率工具",
    "url": "https://example-kaoyan.app",
    "experience_report_ref": "EV-PTA-20260807-004",
    "pricing_claim": "基础功能免费，进阶排序 29 元/月"
  },
  "target_users": {
    "raw_description": "准备考研的学生，特别是二战、时间紧、资料太多不知道看哪份的人",
    "segments": [
      "距考试 3 个月内的二战考研生",
      "跨专业首战考研生",
      "在职备考的社会考生"
    ],
    "exclusions": ["已上岸的学生"],
    "claimed_payer": "学生本人，少数由家长代付",
    "claimed_first_user": "距考试 3 个月内的二战考研生"
  },
  "product_tasks": [
    {
      "task_key": "upload_and_rank",
      "description": "上传 10 份资料并得到本周应看的 3 份排序结果",
      "expected_observable_outcome": "页面显示 3 份资料的排序列表，每份带推荐理由",
      "max_steps": 8
    },
    {
      "task_key": "adjust_by_deadline",
      "description": "把考试日期改为 45 天后，观察清单是否重新排序",
      "expected_observable_outcome": "清单顺序发生变化且提示剩余天数",
      "max_steps": 5
    },
    {
      "task_key": "export_weekly_plan",
      "description": "导出本周学习清单",
      "expected_observable_outcome": "生成可保存的清单文件或分享链接",
      "max_steps": 4
    }
  ],
  "existing_user_evidence": [
    {
      "evidence_id": "EV-USR-REAL-0001",
      "kind": "interview",
      "tier": "E3",
      "source": "2026-07 真实用户访谈记录（8 人，录音存档 MinIO://interviews/2026-07）",
      "timestamp": "2026-07-25",
      "expiry": "2027-01-25",
      "observation": "8 名受访者中 7 人描述出上一次筛资料的具体耗时，平均每周 3.5 小时；6 人已用 Excel 或文件夹绕行",
      "sample_size": 8,
      "applies_to_segment": "距考试 3 个月内的二战考研生",
    "applies_to_product_version": "V1.0",
    "supporting_claims": ["H1"],
    "valid_for_dimensions": ["demand_strength", "pain_severity", "alternative_gap"]
    },
    {
      "evidence_id": "EV-USR-REAL-0002",
      "kind": "usability_test",
      "tier": "E3",
      "source": "2026-07 可用性测试（5 人，出声思考）",
      "timestamp": "2026-07-28",
      "expiry": "2027-01-28",
      "observation": "5 人中 4 人独立完成 upload_and_rank；导出任务 3 人失败，均卡在导出按钮无响应",
      "sample_size": 5,
      "applies_to_segment": "距考试 3 个月内的二战考研生",
    "applies_to_product_version": "V1.0",
    "supporting_claims": ["H1"],
    "valid_for_dimensions": ["pain_severity"]
    },
    {
      "evidence_id": "EV-USR-REAL-0003",
      "kind": "retention_data",
      "tier": "E4",
      "source": "内测埋点导出 2026-07-01 ~ 2026-07-31",
      "timestamp": "2026-08-01",
      "expiry": "2026-11-01",
      "observation": "80 名内测用户 D7 留存 34%，D30 留存 18%；周活跃用户平均每周打开 3.2 次",
      "sample_size": 80,
      "applies_to_segment": "距考试 3 个月内的二战考研生",
    "applies_to_product_version": "V1.0",
    "valid_for_dimensions": ["usage_frequency"]
    },
    {
      "evidence_id": "EV-USR-REAL-0004",
      "kind": "payment_record",
      "tier": "E5",
      "source": "支付流水导出 2026-07（订单号脱敏）",
      "timestamp": "2026-08-01",
      "expiry": "2027-08-01",
      "observation": "12 名用户完成 29 元/月付费，其中 4 人已续费第二个月",
      "sample_size": 12,
      "applies_to_segment": "距考试 3 个月内的二战考研生",
    "applies_to_product_version": "V1.0",
    "supporting_claims": ["H2"],
    "valid_for_dimensions": ["willingness_to_pay"]
    },
    {
      "evidence_id": "EV-USR-REAL-0005",
      "applies_to_product_version": "V1.0",
      "kind": "team_statement",
      "tier": "E0",
      "source": "团队提交的项目说明",
      "timestamp": "2026-08-01",
      "observation": "团队认为产品具备天然传播性，学生会主动推荐给研友",
      "applies_to_segment": "距考试 3 个月内的二战考研生"
    }
  ],
  "validation_goal": {
    "objective": "在已有 E3/E4/E5 真实证据的前提下，校准模拟结论并确认剩余未验证假设",
    "focus_questions": [
      "用户是否真的需要这个产品",
      "用户为什么使用或拒绝使用",
      "下一步应该如何验证用户需求"
    ],
    "priority_dimension": "willingness_to_pay"
  },
  "product_stage": "mvp",
  "constraints": {
    "time_budget_weeks": 6,
    "money_budget_cny": 4000,
    "recruitable_channels": ["考研微信群", "学校自习室", "内测用户群"],
    "team_capacity_person_days": 15,
    "compliance_notes": null
  },
  "evidence_refs": ["EV-PTA-20260807-004"],
  "runtime": {
    "allowed_tools": ["product_reader", "simulation_engine", "evidence_writer", "kb_retriever"],
    "mode": "first_validation",
    "max_simulation_retries": 2
  }
}
