{
  "task_id": "T-UVD-20260809-004",
  "project_id": "PRJ-KAOYAN-NOTES",
  "product_version": "V1.0",
  "product_profile": {
    "name": "考研资料速筛助手",
    "one_line_value_claim": "帮二战考研生在 5 分钟内从海量资料里筛出本周该看的 3 份重点",
    "description": "上传或粘贴资料链接，按考纲与剩余天数自动排序，生成本周学习清单。团队尚未做过任何真实用户访谈。",
    "category": "教育效率工具",
    "url": "https://example-kaoyan.app",
    "experience_report_ref": "EV-PTA-20260807-004",
    "pricing_claim": "基础功能免费，进阶排序 29 元/月"
  },
  "target_users": {
    "raw_description": "准备考研的学生，特别是二战、时间紧、资料太多不知道看哪份的人",
    "segments": [
      "距考试 3 个月内的二战考研生",
      "跨专业首战考研生",
      "在职备考的社会考生"
    ],
    "exclusions": ["已上岸的学生"],
    "claimed_payer": "学生本人",
    "claimed_first_user": "距考试 3 个月内的二战考研生"
  },
  "product_tasks": [
    {
      "task_key": "upload_and_rank",
      "description": "上传 10 份资料并得到本周应看的 3 份排序结果",
      "expected_observable_outcome": "页面显示 3 份资料的排序列表，每份带推荐理由",
      "max_steps": 8
    },
    {
      "task_key": "adjust_by_deadline",
      "description": "把考试日期改为 45 天后，观察清单是否重新排序",
      "expected_observable_outcome": "清单顺序发生变化且提示剩余天数",
      "max_steps": 5
    },
    {
      "task_key": "export_weekly_plan",
      "description": "导出本周学习清单",
      "expected_observable_outcome": "生成可保存的清单文件或分享链接",
      "max_steps": 4
    }
  ],
  "existing_user_evidence": [
    {
      "evidence_id": "EV-USR-SIMONLY-0001",
      "kind": "team_statement",
      "tier": "E0",
      "source": "团队提交的项目说明",
      "timestamp": "2026-08-01",
      "observation": "团队称考研生普遍有资料筛选痛点，但未提供任何用户侧记录",
      "applies_to_segment": "距考试 3 个月内的二战考研生"
    }
  ],
  "validation_goal": {
    "objective": "在完全没有真实用户证据的情况下，确认下一步最该验证哪条用户假设",
    "focus_questions": [
      "用户是否真的需要这个产品",
      "下一步应该如何验证用户需求"
    ],
    "priority_dimension": "demand_strength"
  },
  "product_stage": "mvp",
  "constraints": {
    "time_budget_weeks": 4,
    "money_budget_cny": 2000,
    "recruitable_channels": ["考研微信群", "学校自习室"],
    "team_capacity_person_days": 10,
    "compliance_notes": null
  },
  "evidence_refs": [],
  "runtime": {
    "allowed_tools": ["product_reader", "simulation_engine", "evidence_writer", "kb_retriever"],
    "mode": "first_validation",
    "max_simulation_retries": 2
  }
}
